{
  "$schema": "../../schema/lesson.schema.json",
  "id": "lesson-03",
  "title": "Vokabeln Arbeit & Beruf",
  "level": "A1",
  "description": "Vokabeln zu Berufen, Arbeitsplatz, Zeitangaben und Fragen zum Beruf.",
  "vocabulary": [
    { "id": "v-farmacevt", "sl": "farmacevt, farmacevtka", "de": "Apotheker, Apothekerin" },
    { "id": "v-novinar", "sl": "novinar, novinarka", "de": "Journalist, Journalistin" },
    { "id": "v-receptor", "sl": "receptor, receptorka", "de": "Rezeptionist, Rezeptionistin" },
    { "id": "v-programer", "sl": "programer, programerka", "de": "Programmierer, Programmiererin" },
    { "id": "v-zdravnik", "sl": "zdravnik, zdravnica", "de": "Arzt, Ärztin" },
    { "id": "v-gospodinja", "sl": "gospodinja", "de": "Hausfrau" },
    { "id": "v-sef", "sl": "šef, šefinja", "de": "Chef, Chefin" },
    { "id": "v-direktor", "sl": "direktor, direktorica", "de": "Direktor, Direktorin" },
    { "id": "v-sodelavec", "sl": "sodelavec, sodelavka", "de": "Mitarbeiter, Mitarbeiterin" },
    { "id": "v-stranka", "sl": "stranka", "de": "Kunde" },
    { "id": "v-delo", "sl": "delo", "de": "Arbeit" },
    { "id": "v-poklic", "sl": "poklic", "de": "Beruf" },
    { "id": "v-placa", "sl": "plača", "de": "Gehalt" },
    { "id": "v-honorar", "sl": "honorar", "de": "Honorar" },
    { "id": "v-malica", "sl": "malica", "de": "Imbiss" },
    { "id": "v-dopust", "sl": "dopust", "de": "Urlaub" },
    { "id": "v-bolniska", "sl": "bolniška", "de": "Krankschreibung" },
    { "id": "v-sluzbeno-potovanje", "sl": "službeno potovanje", "de": "Geschäftsreise" },
    { "id": "v-pisarna", "sl": "pisarna", "de": "Büro" },
    { "id": "v-podjetje", "sl": "podjetje", "de": "Unternehmen" },
    { "id": "v-firma", "sl": "firma", "de": "Firma" },
    { "id": "v-agencija", "sl": "agencija", "de": "Agentur" },
    { "id": "v-zdravstveni-dom", "sl": "zdravstveni dom", "de": "Gesundheitszentrum, Ärztehaus" },
    { "id": "v-lekarna", "sl": "lekarna", "de": "Apotheke" },
    { "id": "v-sestanek", "sl": "sestanek", "de": "Treffen" },
    { "id": "v-poslovno-kosilo", "sl": "poslovno kosilo", "de": "Geschäftsessen" },
    { "id": "v-fotokopija", "sl": "fotokopija", "de": "Fotokopie" },
    { "id": "v-fakulteta", "sl": "fakulteta", "de": "Fakultät" },
    { "id": "v-izpit", "sl": "izpit", "de": "Prüfung" },
    { "id": "v-diploma", "sl": "diploma", "de": "Diplom" },
    { "id": "v-studentski-servis", "sl": "študentski servis", "de": "Studentenservice" },
    { "id": "v-prej", "sl": "prej", "de": "früher" },
    { "id": "v-zdaj", "sl": "zdaj", "de": "jetzt" },
    { "id": "v-vcasih", "sl": "včasih", "de": "manchmal" },
    { "id": "v-vceraj", "sl": "včeraj", "de": "gestern" },
    { "id": "v-danes", "sl": "danes", "de": "heute" },
    { "id": "v-prejsnji-teden", "sl": "prejšnji teden", "de": "letzte Woche" },
    { "id": "v-prejsnji-mesec", "sl": "prejšnji mesec", "de": "letzten Monat" },
    { "id": "v-lani", "sl": "lani", "de": "letztes Jahr" },
    { "id": "v-letos", "sl": "letos", "de": "dieses Jahr" },
    { "id": "v-iskati", "sl": "iskati, iščem", "de": "suchen, ich suche" },
    { "id": "v-najti", "sl": "najti, najdem", "de": "finden, ich finde" },
    { "id": "v-dobiti", "sl": "dobiti, dobim", "de": "bekommen, ich bekomme" },
    { "id": "v-delati", "sl": "delati, delam", "de": "arbeiten, ich arbeite" },
    { "id": "v-klicati", "sl": "klicati, kličem", "de": "anrufen, ich rufe an" },
    { "id": "v-organizirati", "sl": "organizirati, organiziram", "de": "organisieren, ich organisiere" },
    { "id": "v-fotokopirati", "sl": "fotokopirati, fotokopiram", "de": "fotokopieren, ich fotokopiere" },
    { "id": "v-rezervirati", "sl": "rezervirati, rezerviram", "de": "reservieren, ich reserviere" },
    { "id": "v-poslati", "sl": "poslati, pošljem", "de": "schicken, ich schicke" },
    { "id": "v-sporociti", "sl": "sporočiti, sporočim", "de": "mitteilen, ich teile mit" },
    { "id": "v-kaj-si-po-poklicu", "sl": "Kaj si po poklicu?", "de": "Was bist du von Beruf?" },
    { "id": "v-kje-delas", "sl": "Kje delaš?", "de": "Wo arbeitest du?" },
    { "id": "v-kaj-delas", "sl": "Kaj delaš?", "de": "Was machst du?" },
    { "id": "v-a-ti-je-tvoje-delo-vsec", "sl": "A ti je tvoje delo všeč?", "de": "Gefällt dir deine Arbeit?" },
    { "id": "v-po-poklicu-sem-farmacevt", "sl": "(Po poklicu) sem farmacevt.", "de": "Ich bin Apotheker." },
    { "id": "v-prodajam-zdravila", "sl": "Prodajam zdravila.", "de": "Ich verkaufe Medikamente." },
    { "id": "v-ja", "sl": "Ja, zanimivo je.", "de": "Ja, es ist interessant." },
    { "id": "v-ne", "sl": "Ne, ni mi všeč.", "de": "Nein, das gefällt mir nicht." }
  ],
  "exercises": [
    { "id": "f-farmacevt", "type": "flashcard", "vocabId": "v-farmacevt" },
    { "id": "f-novinar", "type": "flashcard", "vocabId": "v-novinar" },
    { "id": "f-receptor", "type": "flashcard", "vocabId": "v-receptor" },
    { "id": "f-programer", "type": "flashcard", "vocabId": "v-programer" },
    { "id": "f-zdravnik", "type": "flashcard", "vocabId": "v-zdravnik" },
    { "id": "f-gospodinja", "type": "flashcard", "vocabId": "v-gospodinja" },
    { "id": "f-sef", "type": "flashcard", "vocabId": "v-sef" },
    { "id": "f-direktor", "type": "flashcard", "vocabId": "v-direktor" },
    { "id": "f-sodelavec", "type": "flashcard", "vocabId": "v-sodelavec" },
    { "id": "f-stranka", "type": "flashcard", "vocabId": "v-stranka" },
    { "id": "f-delo", "type": "flashcard", "vocabId": "v-delo" },
    { "id": "f-poklic", "type": "flashcard", "vocabId": "v-poklic" },
    { "id": "f-placa", "type": "flashcard", "vocabId": "v-placa" },
    { "id": "f-honorar", "type": "flashcard", "vocabId": "v-honorar" },
    { "id": "f-malica", "type": "flashcard", "vocabId": "v-malica" },
    { "id": "f-dopust", "type": "flashcard", "vocabId": "v-dopust" },
    { "id": "f-bolniska", "type": "flashcard", "vocabId": "v-bolniska" },
    { "id": "f-sluzbeno-potovanje", "type": "flashcard", "vocabId": "v-sluzbeno-potovanje" },
    { "id": "f-pisarna", "type": "flashcard", "vocabId": "v-pisarna" },
    { "id": "f-podjetje", "type": "flashcard", "vocabId": "v-podjetje" },
    { "id": "f-firma", "type": "flashcard", "vocabId": "v-firma" },
    { "id": "f-agencija", "type": "flashcard", "vocabId": "v-agencija" },
    { "id": "f-zdravstveni-dom", "type": "flashcard", "vocabId": "v-zdravstveni-dom" },
    { "id": "f-lekarna", "type": "flashcard", "vocabId": "v-lekarna" },
    { "id": "f-sestanek", "type": "flashcard", "vocabId": "v-sestanek" },
    { "id": "f-poslovno-kosilo", "type": "flashcard", "vocabId": "v-poslovno-kosilo" },
    { "id": "f-fotokopija", "type": "flashcard", "vocabId": "v-fotokopija" },
    { "id": "f-fakulteta", "type": "flashcard", "vocabId": "v-fakulteta" },
    { "id": "f-izpit", "type": "flashcard", "vocabId": "v-izpit" },
    { "id": "f-diploma", "type": "flashcard", "vocabId": "v-diploma" },
    { "id": "f-studentski-servis", "type": "flashcard", "vocabId": "v-studentski-servis" },
    { "id": "f-prej", "type": "flashcard", "vocabId": "v-prej" },
    { "id": "f-zdaj", "type": "flashcard", "vocabId": "v-zdaj" },
    { "id": "f-vcasih", "type": "flashcard", "vocabId": "v-vcasih" },
    { "id": "f-vceraj", "type": "flashcard", "vocabId": "v-vceraj" },
    { "id": "f-danes", "type": "flashcard", "vocabId": "v-danes" },
    { "id": "f-prejsnji-teden", "type": "flashcard", "vocabId": "v-prejsnji-teden" },
    { "id": "f-prejsnji-mesec", "type": "flashcard", "vocabId": "v-prejsnji-mesec" },
    { "id": "f-lani", "type": "flashcard", "vocabId": "v-lani" },
    { "id": "f-letos", "type": "flashcard", "vocabId": "v-letos" },
    { "id": "f-iskati", "type": "flashcard", "vocabId": "v-iskati" },
    { "id": "f-najti", "type": "flashcard", "vocabId": "v-najti" },
    { "id": "f-dobiti", "type": "flashcard", "vocabId": "v-dobiti" },
    { "id": "f-delati", "type": "flashcard", "vocabId": "v-delati" },
    { "id": "f-klicati", "type": "flashcard", "vocabId": "v-klicati" },
    { "id": "f-organizirati", "type": "flashcard", "vocabId": "v-organizirati" },
    { "id": "f-fotokopirati", "type": "flashcard", "vocabId": "v-fotokopirati" },
    { "id": "f-rezervirati", "type": "flashcard", "vocabId": "v-rezervirati" },
    { "id": "f-poslati", "type": "flashcard", "vocabId": "v-poslati" },
    { "id": "f-sporociti", "type": "flashcard", "vocabId": "v-sporociti" },
    { "id": "f-kaj-si-po-poklicu", "type": "flashcard", "vocabId": "v-kaj-si-po-poklicu" },
    { "id": "f-kje-delas", "type": "flashcard", "vocabId": "v-kje-delas" },
    { "id": "f-kaj-delas", "type": "flashcard", "vocabId": "v-kaj-delas" },
    { "id": "f-a-ti-je-tvoje-delo-vsec", "type": "flashcard", "vocabId": "v-a-ti-je-tvoje-delo-vsec" },
    { "id": "f-po-poklicu-sem-farmacevt", "type": "flashcard", "vocabId": "v-po-poklicu-sem-farmacevt" },
    { "id": "f-prodajam-zdravila", "type": "flashcard", "vocabId": "v-prodajam-zdravila" },
    { "id": "f-ja", "type": "flashcard", "vocabId": "v-ja" },
    { "id": "f-ne", "type": "flashcard", "vocabId": "v-ne" }
  ]
}
